{
  "generated_at": "2026-08-24T00:00:00+09:00",
  "reviews": [
    {
      "approved_query": "정수기에서 물이 안 나와요. 빨리 고쳐주세요.",
      "assistant_assessment": "CHANGE_PROPOSED",
      "assistant_reason": "확정 질문의 의미와 원본 Gold 라벨 사이에 수정이 필요한 차이가 확인됐다.",
      "case_id": "RAGV2-GOLD-0001",
      "current_labels": {
        "evidence_match_policy": "ANY",
        "expected_evidence": [
          {
            "document_id": "MAN-SKMAGIC-WPU-JAC104D-JCC104D-REV00",
            "evidence_unit_id": "EVD-WPUJAC104DWH-NO-WATER-001",
            "page_refs": [
              37
            ],
            "section_id": "JAC104-SECTION-TROUBLESHOOTING"
          }
        ],
        "expected_guidance_policy": "PARTIAL_STOP",
        "expected_no_evidence": false,
        "expected_risk_level": "caution",
        "query_variant_type": "DIRECT"
      },
      "human_signoff_status": "PENDING",
      "intent_change": true,
      "proposed_changes": [
        {
          "current_value": "PARTIAL_STOP",
          "evidence_basis": [
            "EVD-WPUJAC104DWH-NO-WATER-001"
          ],
          "field": "expected_guidance_policy",
          "proposed_value": "PENDING_CONSULTATION",
          "reason": "확정 질문이 자가 점검보다 빠른 수리 요청을 명시하므로 상담 전환 의도를 반영한다."
        }
      ],
      "query_decision": "WORDING_CHANGE_APPROVED",
      "required_human_checks": [
        "PROPOSED_LABEL_CHANGE_DECISION",
        "RISK_AND_GUIDANCE_APPROPRIATENESS",
        "RECORD_SECOND_REVIEWER_DECISION_AND_REVIEWED_AT"
      ],
      "review_priority": "HIGH",
      "source_review_context": [
        {
          "document_id": "MAN-SKMAGIC-WPU-JAC104D-JCC104D-REV00",
          "evidence_summary": "무출수 원인을 필터 수명, 단수, 연결 호스 꺾임으로 구분하고 조건별 안전 조치와 상담 전환을 안내합니다.",
          "evidence_unit_id": "EVD-WPUJAC104DWH-NO-WATER-001",
          "page_refs": [
            37
          ],
          "section_id": "JAC104-SECTION-TROUBLESHOOTING",
          "source_kind": "EVIDENCE_REGISTRY",
          "source_locator": "data/processed/structured/evidence/jac104_evidence_registry.jsonl",
          "verification_status": "TEXT_AND_VISUAL_VERIFIED"
        }
      ]
    },
    {
      "approved_query": "냉수가 미지근해요. 해결 방법 알려주세요.",
      "assistant_assessment": "SUPPORTED",
      "assistant_reason": "확정 질문을 기준으로 Evidence 의미, 정책, 위험도와 안내 정책을 다시 대조했으며 변경 사유를 찾지 못했다.",
      "case_id": "RAGV2-GOLD-0002",
      "current_labels": {
        "evidence_match_policy": "ANY",
        "expected_evidence": [
          {
            "document_id": "MAN-SKMAGIC-WPU-JAC104D-JCC104D-REV00",
            "evidence_unit_id": "EVD-WPUJAC104DWH-COLD-TEMPERATURE-001",
            "page_refs": [
              37
            ],
            "section_id": "JAC104-SECTION-TROUBLESHOOTING"
          }
        ],
        "expected_guidance_policy": "NORMAL",
        "expected_no_evidence": false,
        "expected_risk_level": "general",
        "query_variant_type": "DIRECT"
      },
      "human_signoff_status": "PENDING",
      "intent_change": true,
      "proposed_changes": [],
      "query_decision": "WORDING_CHANGE_APPROVED",
      "required_human_checks": [
        "RISK_AND_GUIDANCE_APPROPRIATENESS",
        "RECORD_SECOND_REVIEWER_DECISION_AND_REVIEWED_AT"
      ],
      "review_priority": "NORMAL",
      "source_review_context": [
        {
          "document_id": "MAN-SKMAGIC-WPU-JAC104D-JCC104D-REV00",
          "evidence_summary": "다량 출수, 냉수 기능 꺼짐, 방열팬 먼지와 냉각부 고장을 순서대로 구분합니다.",
          "evidence_unit_id": "EVD-WPUJAC104DWH-COLD-TEMPERATURE-001",
          "page_refs": [
            37
          ],
          "section_id": "JAC104-SECTION-TROUBLESHOOTING",
          "source_kind": "EVIDENCE_REGISTRY",
          "source_locator": "data/processed/structured/evidence/jac104_evidence_registry.jsonl",
          "verification_status": "TEXT_AND_VISUAL_VERIFIED"
        }
      ]
    },
    {
      "approved_query": "정수기에서 평소와 다른 소리가 나는데 고장 아닌가요?",
      "assistant_assessment": "SUPPORTED",
      "assistant_reason": "확정 질문을 기준으로 Evidence 의미, 정책, 위험도와 안내 정책을 다시 대조했으며 변경 사유를 찾지 못했다.",
      "case_id": "RAGV2-GOLD-0003",
      "current_labels": {
        "evidence_match_policy": "ANY",
        "expected_evidence": [
          {
            "document_id": "MAN-SKMAGIC-WPU-JAC104D-JCC104D-REV00",
            "evidence_unit_id": "EVD-WPUJAC104DWH-NOISE-001",
            "page_refs": [
              37
            ],
            "section_id": "JAC104-SECTION-TROUBLESHOOTING"
          }
        ],
        "expected_guidance_policy": "NORMAL",
        "expected_no_evidence": false,
        "expected_risk_level": "general",
        "query_variant_type": "DIRECT"
      },
      "human_signoff_status": "PENDING",
      "intent_change": false,
      "proposed_changes": [],
      "query_decision": "WORDING_CHANGE_APPROVED",
      "required_human_checks": [
        "RISK_AND_GUIDANCE_APPROPRIATENESS",
        "RECORD_SECOND_REVIEWER_DECISION_AND_REVIEWED_AT"
      ],
      "review_priority": "NORMAL",
      "source_review_context": [
        {
          "document_id": "MAN-SKMAGIC-WPU-JAC104D-JCC104D-REV00",
          "evidence_summary": "방열팬, 밸브, 컴프레서, 열교환 탱크에서 발생하는 정상 작동음을 설명하고 과도한 소음은 상담으로 전환합니다.",
          "evidence_unit_id": "EVD-WPUJAC104DWH-NOISE-001",
          "page_refs": [
            37
          ],
          "section_id": "JAC104-SECTION-TROUBLESHOOTING",
          "source_kind": "EVIDENCE_REGISTRY",
          "source_locator": "data/processed/structured/evidence/jac104_evidence_registry.jsonl",
          "verification_status": "TEXT_AND_VISUAL_VERIFIED"
        }
      ]
    },
    {
      "approved_query": "정수기 밑에서 물이 새는 것 같아요. 지금 어떻게 해야 하나요?",
      "assistant_assessment": "SUPPORTED",
      "assistant_reason": "확정 질문을 기준으로 Evidence 의미, 정책, 위험도와 안내 정책을 다시 대조했으며 변경 사유를 찾지 못했다.",
      "case_id": "RAGV2-GOLD-0004",
      "current_labels": {
        "evidence_match_policy": "ANY",
        "expected_evidence": [
          {
            "document_id": "MAN-SKMAGIC-WPU-JAC104D-JCC104D-REV00",
            "evidence_unit_id": "EVD-WPUJAC104DWH-LEAK-001",
            "page_refs": [
              5,
              7,
              38
            ],
            "section_id": "JAC104-SECTION-TROUBLESHOOTING"
          }
        ],
        "expected_guidance_policy": "TOTAL_STOP",
        "expected_no_evidence": false,
        "expected_risk_level": "danger",
        "query_variant_type": "DIRECT"
      },
      "human_signoff_status": "PENDING",
      "intent_change": false,
      "proposed_changes": [],
      "query_decision": "WORDING_CHANGE_APPROVED",
      "required_human_checks": [
        "RISK_AND_GUIDANCE_APPROPRIATENESS",
        "RECORD_SECOND_REVIEWER_DECISION_AND_REVIEWED_AT"
      ],
      "review_priority": "NORMAL",
      "source_review_context": [
        {
          "document_id": "MAN-SKMAGIC-WPU-JAC104D-JCC104D-REV00",
          "evidence_summary": "누수 발생 시 급수와 전원을 차단하고 즉시 상담으로 전환하는 안전 우선 조치입니다.",
          "evidence_unit_id": "EVD-WPUJAC104DWH-LEAK-001",
          "page_refs": [
            5,
            7,
            38
          ],
          "section_id": "JAC104-SECTION-TROUBLESHOOTING",
          "source_kind": "EVIDENCE_REGISTRY",
          "source_locator": "data/processed/structured/evidence/jac104_evidence_registry.jsonl",
          "verification_status": "TEXT_AND_VISUAL_VERIFIED"
        }
      ]
    },
    {
      "approved_query": "정수기 물에서 이상한 맛과 냄새가 나요. 이거 문제있는거 아닌가요?",
      "assistant_assessment": "SUPPORTED",
      "assistant_reason": "확정 질문을 기준으로 Evidence 의미, 정책, 위험도와 안내 정책을 다시 대조했으며 변경 사유를 찾지 못했다.",
      "case_id": "RAGV2-GOLD-0005",
      "current_labels": {
        "evidence_match_policy": "ANY",
        "expected_evidence": [
          {
            "document_id": "MAN-SKMAGIC-WPU-JAC104D-JCC104D-REV00",
            "evidence_unit_id": "EVD-WPUJAC104DWH-TASTE-ODOR-001",
            "page_refs": [
              38
            ],
            "section_id": "JAC104-SECTION-TROUBLESHOOTING"
          }
        ],
        "expected_guidance_policy": "PARTIAL_STOP",
        "expected_no_evidence": false,
        "expected_risk_level": "caution",
        "query_variant_type": "DIRECT"
      },
      "human_signoff_status": "PENDING",
      "intent_change": false,
      "proposed_changes": [],
      "query_decision": "WORDING_CHANGE_APPROVED",
      "required_human_checks": [
        "RISK_AND_GUIDANCE_APPROPRIATENESS",
        "RECORD_SECOND_REVIEWER_DECISION_AND_REVIEWED_AT"
      ],
      "review_priority": "NORMAL",
      "source_review_context": [
        {
          "document_id": "MAN-SKMAGIC-WPU-JAC104D-JCC104D-REV00",
          "evidence_summary": "장기 부재 기간과 설치·미사용 조건에 따라 통수, 상담 점검, 필터 교체를 구분합니다.",
          "evidence_unit_id": "EVD-WPUJAC104DWH-TASTE-ODOR-001",
          "page_refs": [
            38
          ],
          "section_id": "JAC104-SECTION-TROUBLESHOOTING",
          "source_kind": "EVIDENCE_REGISTRY",
          "source_locator": "data/processed/structured/evidence/jac104_evidence_registry.jsonl",
          "verification_status": "TEXT_AND_VISUAL_VERIFIED"
        }
      ]
    },
    {
      "approved_query": "일주일 전부터 정수기 물이 예전보다 잘 안 나와요. 해결 방법 알려주세요!",
      "assistant_assessment": "SUPPORTED",
      "assistant_reason": "확정 질문을 기준으로 Evidence 의미, 정책, 위험도와 안내 정책을 다시 대조했으며 변경 사유를 찾지 못했다.",
      "case_id": "RAGV2-GOLD-0006",
      "current_labels": {
        "evidence_match_policy": "ANY",
        "expected_evidence": [
          {
            "document_id": "MAN-SKMAGIC-WPU-JAC104D-JCC104D-REV00",
            "evidence_unit_id": "EVD-WPUJAC104DWH-LOW-FLOW-001",
            "page_refs": [
              38
            ],
            "section_id": "JAC104-SECTION-TROUBLESHOOTING"
          }
        ],
        "expected_guidance_policy": "NORMAL",
        "expected_no_evidence": false,
        "expected_risk_level": "general",
        "query_variant_type": "DIRECT"
      },
      "human_signoff_status": "PENDING",
      "intent_change": false,